film,number,abstract,starring,name,subjects,cinematography,director,gross,producer,language
F (film),30469517,F (also known as The Expelled) is a 2010 British slasher film written and directed by Johannes Roberts and starring David Schofield and Eliza Bennett.,David Schofield (actor)--Eliza Bennett--Juliet Aubrey--Roxanne McKee--Ruth Gemmell,F,2010 films-2010 horror films-2010 horror thriller films-2010s high school films-British films-British high school films-British horror thriller films-English-language films-Films about dysfunctional families-Films about educators-Films about school violence-Films directed by Johannes Roberts-Films set in London-Films with screenplays by Johannes Roberts,na,Johannes Roberts,na,Johannes Roberts,English
Shirome (film),33188259,"Shirome (シロメ, White Eyes) is a 2010 Japanese mockumentary horror film written and directed by Kōji Shiraishi. It is presented in a found footage style, and concerns a school which is haunted by a wish-granting spirit. Shiraishi appears in a starring role within the film, playing himself, as do the six then-members of the Japanese idol group Momoiro Clover Z.",--Akari Hayami--Ayaka Sasaki--Kanako Momota--Momoka Ariyasu--Reni Takagi--Shiori Tamai,Shirome,2010 films-2010 horror films-Films directed by Kōji Shiraishi-Found footage films-Japanese films-Japanese horror films-Japanese psychological horror films-Japanese supernatural horror films-Mockumentary films,na,Kōji Shiraishi,na,Kōji Shiraishi,Japanese
Primal (2010 film),34431209,"Primal is a 2010 Australian horror film directed by Josh Reed, and starring Zoe Tuckwell-Smith, Krew Boylan, Lindsay Farris, and Wil Traval.",Lindsay Farris--Zoe Tuckwell-Smith,Primal,2010 films-2010 horror films-2010 horror thriller films-2010s exploitation films-Australian films-Australian horror thriller films-Australian natural horror films-English-language films-Films set in Australia-Films shot in Australia-Films shot in New South Wales,na,na,na,na,English
Cannibal (2010 film),54308271,"Cannibal is a 2010 Belgian horror film written and directed by Benjamin Viré. It stars Nicolas Gob, , and Eric Godon.",Helena Coppejans--Micky Molina--Eric Godon--Nicolas Gob--Philippe Nahon,Cannibal,2010 films-2010 horror films-Belgian films,na,na,na,na,French
Secret Sunday,24938872,"Secret Sunday (or Number 9) (Thai: 9 วัด; translit. 9 wat; English: 9 temples), a 2010 Thai horror film, is a directorial debut from screenwriter Saranyu Jiralaksanakul and stars Siraphun Wattanajinda and James Alexander.",James Alexander--Siraphun Wattanjinda,Secret Sunday,2010 directorial debut films-2010 films-2010 horror films-Films set in the 2010s-Thai-language films-Thai films-Thai ghost films-Thai horror films,na,na,na,na,Thai
Sennentuntschi,46263609,Sennentuntschi is a 2010 Swiss film written and directed by Michael Steiner. It is based on an eponymous Alpine fable. The film premiered at the 2010 Zurich Film Festival.,--Andrea Zogg--Carlos Leal--Roxane Mesquida,Sennentuntschi,2010 films-2010 horror films-2010s fantasy films-2010s mystery films-2010s psychological horror films-Dark fantasy films-Films set in 1975-Films set in the Alps-Folk horror films-Mystery horror films-Swiss German-language films-Swiss films-Swiss horror films,na,na,na,na,http://dbpedia.org/resource/Swiss_German
Closed for the Season (film),25466355,"Closed for the Season is a 2010 supernatural thriller film written and directed by Jay Woelfel, starring Aimee Brooks, Damian Maffei, and Joe Unger.",Aimee Brooks--Damian Maffei--Joe Unger,Closed for the Season,2010 films-2010 horror films-American films-American ghost films-American supernatural horror films-American supernatural thriller films-English-language films-Films set in Ohio-Films set in the United States-Films shot in Los Angeles-Films shot in Ohio-Horror films about clowns,na,na,na,na,English
Slices of Life,28030619,"Slices of Life is independent film maker Anthony G Sumner's feature length horror anthology, which explores the terror of everyday life. 4 years in the making, Slices of Life completed production in 2010.",--Deneen Melody--Jack Guasta--Kaylee Williams--Toya Turner,Slices of Life,2010 films-2010 horror films-American films-American independent films-American supernatural horror films-English-language films,na,na,na,na,English
Dead Awake (2010 film),31699282,"Dead Awake is a 2010 American mystery film starring Nick Stahl, Rose McGowan, and Amy Smart. The film was previously titled Dylan's Wake.",Amy Smart--Nick Stahl--Rose McGowan,Dead Awake,2010 films-2010 horror films-2010 psychological thriller films-2010s English-language films-American films-American horror thriller films-American psychological horror films-Films shot in Iowa-Mystery horror films,na,Omar Naim,na,Omar Naim,na
Medium Raw: Night of the Wolf,39637957,Medium Raw: Night of the Wolf is a 2010 horror thriller television film directed by Andrew Cymek. The run time is 111 minutes.,--Brigitte Kingsley--John Rhys-Davies--William B. Davis,Medium Raw: Night of the Wolf,2010 films-2010 horror films-2010 television films-2010s crime films-2010s thriller films-Canadian films-Canadian independent films,na,na,na,na,na
Don't Be Afraid of the Dark (2010 film),24026566,"Don't Be Afraid of the Dark is a 2010 horror film written by Matthew Robbins and Guillermo del Toro and directed by comic book artist Troy Nixey. It is a remake of the 1973 ABC made-for-television horror film of the same name. The film stars Katie Holmes, Guy Pearce, and Bailee Madison, as a family moving into a 19th-century Rhode Island mansion, where the withdrawn daughter (Sally) begins to witness malevolent creatures that emerge from a sealed ash pit in the basement of the house. Jack Thompson, Alan Dale, Garry McDonald, and Julia Blake star in supporting roles.",--Bailee Madison--Guy Pearce--Jack Thompson--Katie Holmes,Don't Be Afraid of the Dark,2010 films-2010 horror films-2010s monster movies-American film remakes-American films-American monster movies-English-language films-Films produced by Guillermo del Toro-Films scored by Marco Beltrami-Films set in Rhode Island-Films shot in Melbourne-Films with screenplays by Guillermo del Toro-Films with screenplays by Matthew Robbins-Gothic horror films-Horror film remakes-Mexican fantasy films-Mexican films-Mexican horror films,Oliver Stapleton,Troy Nixey,3.83E7,Troy Nixey,English
Insidious (film),27645834,"Insidious is a 2010 American-Canadian supernatural horror film directed by James Wan, written by Leigh Whannell, and starring Patrick Wilson, Rose Byrne, and Barbara Hershey. It is the first installment in the Insidious franchise, and the third in terms of the series' in-story chronology. The story centers on a couple whose son inexplicably enters a comatose state and becomes a vessel for a variety of malevolent entities in an astral dimension.",--Barbara Hershey--Patrick Wilson--Rose Byrne,Insidious,2010 films-2010 horror films-2010 independent films-2010s ghost films-2010s psychological horror films-2010s supernatural horror films-American films-American haunted house films-American independent films-American psychological horror films-American supernatural horror films-Blumhouse Productions films-Canadian films-Canadian independent films-Canadian supernatural horror films-Demons in film-English-language films-FilmDistrict films-Films about sleep disorders-Films about spirit possession-Films directed by James Wan-Films produced by Jason Blum-Films scored by Joseph Bishara-Films shot in Los Angeles-Films with screenplays by Leigh Whannell-Insidious (film series)-Purgatory in fiction,John R. Leonetti,James Wan,9.95E7,James Wan,English
The Last Exorcism,26588977,"The Last Exorcism is a 2010 American found footage supernatural horror film directed by Daniel Stamm. It stars Patrick Fabian, Ashley Bell, Iris Bahr, and Louis Herthum. After years of performing exorcisms, a disillusioned evangelical minister decides to participate in a documentary chronicling his last exorcism while exposing the fraud of his ministry. After receiving a letter from a farmer asking for help in driving out the devil, he meets the farmer's afflicted daughter.The film received positive reviews from critics and was a box office success, grossing more than $67 million against a $1.8 million budget.",Ashley Bell (actress)--Patrick Fabian,The Last Exorcism,"2010 films-2010 horror films-2010s supernatural films-American films-American mockumentary films-American supernatural horror films-Baton Rouge, Louisiana-Camcorder films-English-language films-Films about exorcism-Films produced by Eli Roth-Films produced by Marc Abraham-Films scored by Nathan Barr-Films set in Louisiana-Films shot in Louisiana-Films shot in New Orleans-Found footage films-StudioCanal films-Vivendi franchises",na,Daniel Stamm,6.77E7,Daniel Stamm,English
Dante's Inferno: An Animated Epic,25744220,"Dante's Inferno: An Animated Epic is a direct to DVD animated dark fantasy action film released on February 9, 2010. Based on Dante's Inferno video game which is itself loosely based on Dante's Inferno, Dante must travel through the circles of Hell and battle demons, creatures, monsters, and even Lucifer himself to save his beloved Beatrice.",--Graham McTavish--Peter Jessop,Dante's Inferno: An Animated Epic,2010 animated films-2010 anime films-2010 direct-to-video films-2010 films-2010 horror films-2010s American animated films-2010s action horror films-2010s fantasy action films-American action horror films-American adult animated films-American animated horror films-American anthology films-American dark fantasy films-American films-American horror anthology films-Animated films based on video games-Anime films based on video games-Demons in film-English-language films-Fantasy anthology films-Film Roman films-Films based on works by Dante Alighieri-Films set in hell-Greco-Roman mythology in popular culture-Horror anime and manga-Japanese action horror films-Japanese animated fantasy films-Japanese animated horror films-Japanese anthology films-Japanese dark fantasy films-Japanese films-Limbo-Manglobe-Production I.G-Purgatory in fiction-South Korean animated horror films-South Korean films-The Devil in film-Works based on Electronic Arts video games,na,Mike Disa,na,Mike Disa,English
Dante's Inferno: An Animated Epic,25744220,"Dante's Inferno: An Animated Epic is a direct to DVD animated dark fantasy action film released on February 9, 2010. Based on Dante's Inferno video game which is itself loosely based on Dante's Inferno, Dante must travel through the circles of Hell and battle demons, creatures, monsters, and even Lucifer himself to save his beloved Beatrice.",--Graham McTavish--Peter Jessop,Dante's Inferno: An Animated Epic,2010 animated films-2010 anime films-2010 direct-to-video films-2010 films-2010 horror films-2010s American animated films-2010s action horror films-2010s fantasy action films-American action horror films-American adult animated films-American animated horror films-American anthology films-American dark fantasy films-American films-American horror anthology films-Animated films based on video games-Anime films based on video games-Demons in film-English-language films-Fantasy anthology films-Film Roman films-Films based on works by Dante Alighieri-Films set in hell-Japanese films-Limbo-Production I.G-South Korean animated horror films-South Korean films-The Devil in film-Works based on Electronic Arts video games,na,Victor Cook,na,Victor Cook,English
Cold Fish,32373933,"Cold Fish (冷たい熱帯魚, Tsumetai Nettaigyo) is a 2010 Japanese film directed by Sion Sono. Cold Fish premiered at the 67th Venice International Film Festival on September 7, 2010, and received the best screenplay award in the Fantastic Features section at Fantastic Fest 2010. The film was released as part of the Bloody Disgusting Selects line.",Asuka Kurosawa--Denden--Mitsuru Fukikoshi,Cold Fish,2010 films-2010 horror films-2010 horror thriller films-2010s serial killer films-Films directed by Sion Sono-Horror films based on actual events-Japanese films-Japanese horror thriller films-Japanese serial killer films-Nikkatsu films,na,Sion Sono,na,Sion Sono,Japanese
Dinoshark,27663923,"Dinoshark is a 2010 low budget Syfy horror film. It was shown on Syfy on March 13, 2010.",Eric Balfour,Dinoshark,2010 films-2010 horror films-2010 television films-2010s monster movies-American films-American horror television films-American monster movies-American natural horror films-Films about dinosaurs-Films about shark attacks-Films about sharks-Films produced by Julie Corman-Films produced by Roger Corman-Giant monster films-Shark attacks in fiction-Syfy original films,na,na,na,na,English
Kaalo,29642103,"Kaalo is a Hindi horror film, directed by Wilson Louis and produced by Yash Patnaik, Mamta Patnaik and Dhaval Gada. The film was released on 17 December 2010 under the Beyond Dreams Entertainment Ltd. banner. It was dubbed in Bhojpuri as same title of this name.",Abhijit satham--Sheela David--Tripta--Aditya Lakhia--Aditya Shrivastava--Hemant Pandey--Kanwarjit Paintal--Madhurima Tuli--Raj Arjun--Swini Khara,Kaalo the movie,2010 films-2010 horror films-2010s slasher films-Films set in Rajasthan-Films shot in Rajasthan-Hindi-language horror films-Indian films-Indian horror films-Indian slasher films,na,na,na,na,Hindi
Predicament,41031478,"Predicament is a 2010 comedy horror film based on the 1975 novel by Ronald Hugh Morrieson and starring Jemaine Clement of the musical comedy duo Flight of the Conchords plus Tim Finn of the Finn Brothers. Filmed in Hawera and Eltham in Taranaki, it was the last Morrieson novel to be adapted for cinema; his other three novels were filmed in the 1980s.",Hayden Frost--Heath Franklin--Jemaine Clement--Tim Finn,Predicament,2010 comedy films-2010 comedy horror films-2010 films-2010 horror films-English-language films-Films based on New Zealand novels-Films set in New Zealand-Films set in the 1930s-Films shot in New Zealand-New Zealand comedy horror films-New Zealand films,na,Jason Stutter,na,Jason Stutter,English
13Hrs,31514497,"13Hrs, also known by the name Night Wolf, is a 2010 British horror film directed by Jonathan Glendening. The film stars Isabella Calthorpe as the main female lead, and also features Gemma Atkinson, John Lynch, Joshua Bowman, Antony De Liseo and Tom Felton.",Gemma Atkinson--Isabella Calthorpe--Tom Felton,13,2010 films-2010 horror films-British films-British horror films-British supernatural horror films-English-language films-Werewolves in film,Jordan Cushing,na,na,na,English
Sella Turcica (film),36406869,"Sella Turcica is a 2010 horror film written and directed by Fred Vogel, and co-written by Shelby Vogel and Don Moore.",Allie Nickel--Camille Keaton--Damien A. Maruscak--Harvey Daniels--Jade Risser--Sarah Thornton--Sean P. McCarthy,Sella Turcica,2010 direct-to-video films-2010 war drama films-2010s horror drama films-American zombie films-Films directed by Fred Vogel-Films shot in Ohio-Iraq War films,na,na,na,na,English
A Nightmare on Elm Street (2010 film),23286957,"A Nightmare on Elm Street is a 2010 American slasher film directed by Samuel Bayer, and written by Wesley Strick and Eric Heisserer. The film stars Jackie Earle Haley, Kyle Gallner, Rooney Mara, Katie Cassidy, Thomas Dekker, and Kellan Lutz. Produced by Michael Bay and Platinum Dunes, it is a remake of Wes Craven's 1984 film of the same name and a reboot of the Nightmare on Elm Street franchise. The film is set in a fictitious town of Ohio and centers around a group of teenagers living on one street who are stalked and murdered in their dreams by a disfigured man named Freddy Krueger. The teenagers discover that they all share a common link from their childhood that makes them targets for Krueger.",--Jackie Earle Haley--Katie Cassidy--Kellan Lutz--Kyle Gallner--Rooney Mara--Thomas Dekker,A Nightmare on Elm Street,2010 directorial debut films-2010 films-2010 horror films-2010s ghost films-2010s serial killer films-2010s slasher films-2010s teen horror films-A Nightmare on Elm Street (franchise) films-Adaptations of works by Wes Craven-American film remakes-American films-American films about revenge-American ghost films-American serial killer films-American slasher films-American supernatural horror films-D-Box motion-enhanced films-English-language films-Films about child sexual abuse-Films about nightmares-Films about pedophilia-Films directed by Samuel Bayer-Films produced by Andrew Form-Films produced by Bradley Fuller-Films produced by Michael Bay-Films scored by Steve Jablonsky-Films set in Ohio-Films shot in Illinois-Films shot in Indiana-Horror film remakes-New Line Cinema films-Warner Bros. films,na,Samuel Bayer,1.177E8,Samuel Bayer,English
The Last Exorcism,26588977,"The Last Exorcism is a 2010 American found footage supernatural horror film directed by Daniel Stamm. It stars Patrick Fabian, Ashley Bell, Iris Bahr, and Louis Herthum. After years of performing exorcisms, a disillusioned evangelical minister decides to participate in a documentary chronicling his last exorcism while exposing the fraud of his ministry. After receiving a letter from a farmer asking for help in driving out the devil, he meets the farmer's afflicted daughter.The film received positive reviews from critics and was a box office success, grossing more than $67 million against a $1.8 million budget.",Ashley Bell (actress)--Patrick Fabian,The Last Exorcism,"2010 films-2010 horror films-2010s supernatural films-American films-American mockumentary films-American supernatural horror films-Baton Rouge, Louisiana-Camcorder films-English-language films-Films about exorcism-Films produced by Eli Roth-Films produced by Marc Abraham-Films scored by Nathan Barr-Films set in Louisiana-Films shot in Louisiana-Films shot in New Orleans-Found footage films-StudioCanal films-Vivendi franchises",na,Daniel Stamm,6.77E7,Daniel Stamm,English
Saw 3D,24341999,"Saw 3D (also known as Saw: The Final Chapter) is a 2010 American 3D horror film directed by Kevin Greutert and written by Patrick Melton and Marcus Dunstan. It is the seventh installment in the Saw film series. The film stars Tobin Bell, Costas Mandylor, Betsy Russell, Sean Patrick Flanery, and Cary Elwes. It also featured the final film appearance of Chester Bennington before his death in 2017. The plot follows a man who, after falsely claiming to be a survivor of one of the Jigsaw Killer's games in order to become a local celebrity, finds himself part of a real game where he must save his wife. Meanwhile, Jill Tuck informs the Internal Affairs that rogue Detective Mark Hoffman is the man responsible for the recent Jigsaw games, and Hoffman hunts her down.",--Betsy Russell--Cary Elwes--Costas Mandylor--Sean Patrick Flanery--Tobin Bell,Saw 3D,2010 3D films-Films directed by Kevin Greutert-Films scored by Charlie Clouser,na,Kevin Greutert,1.362E8,Kevin Greutert,English
Carnies (film),8696875,Carnies is a 2010 horror film directed by and starring Doug Jones.,Chris Staviski--Doug Jones (actor)--Lee Perkins (actor)--Reggie Bannister,Carnies,2010 films-2010 horror films-American films-American slasher films,Brian Corder,Brian Corder,na,Brian Corder,English
Denizen (film),25624870,"Denizen is a 2010 low-budget sci-fi horror-action film written and directed by J.A. Steel (also known as Jacquelyn A. Ruffner). The film stars Steel, Julie Corgill, Glen Jensen, Ben Bayless, and Jody Mullins, and is Steel's third feature film.",--Ben Bayless--Dominique Storni--Glen Jensen--J.A. Steel--Julie Corgill,Denizen,2010 LGBT-related films-2010 films-2010 horror films-2010 science fiction action films-2010s monster movies-American LGBT-related films-American action horror films-American films-American monster movies-American science fiction action films-American science fiction horror films-English-language films-Films set in Utah-LGBT-related horror films-LGBT-related science fiction films,na,J.A. Steel,na,J.A. Steel,English
Sparrow (2010 film),27745239,"Sparrow or Wróbel is a 2010 Polish-British slasher horror film, directed by Shaun Troke, written by Matthew Mosley and Justin Di Febo, and produced by independent filmmaker Wojciech Stuchlik. The film stars Jack W. Carter, Alexis Jayne Defoe, , Sarah Linda, Thomas James Longley and Faye Sewell. Sparrow was shot in Poland on a budget of just £20,000, with a primarily British cast. The film premiered in October 2010, and was shown at the American Film Market in November 2011. Sparrow was released on DVD in the U.S in 2013.",Alexis Jayne Defoe--Faye Sewell--Eric Kolelas--Thomas James Longley,Sparrow,2010 films-2010 horror films-2010s slasher films-British films-British horror films-British independent films-British teen horror films-English-language films-Films shot in Poland-Polish films-Polish horror films-Polish teen films,na,Shaun Troke,na,Shaun Troke,English
Mongolian Death Worm (film),32626667,"Mongolian Death Worm is a 2010 television film directed by Steven R. Monroe and stars Sean Patrick Flanery that was aired on May 8, 2010 on Syfy.",Drew Waters--George Cheung--Sean Patrick Flanery--Victoria Pratt,Mongolian Death Worm,2010 action films-2010 films-2010 horror films-2010 television films-2010s monster movies-2010s science fiction films-Action television films-American action films-American films-American monster movies-American science fiction television films-CineTel Films films-Films directed by Steven R. Monroe-Films scored by Pinar Toprak-Sonar Entertainment films-Syfy original films,na,Steven R. Monroe,na,Steven R. Monroe,English
Slime City Massacre,31473316,"Slime City Massacre is a 2010 science fiction comedy-horror sequel film directed by Greg Lamberson and starring Jennifer Bihl, Kealan Patrick Burke, Debbie Rochon and Robert Sabin. It is a sequel to Greg Lamberson's earlier Slime City.",Jennifer Bihl--Robert Sabin--Debbie Rochon--Kealan Patrick Burke,Slime City Massacre,2010 comedy films-2010 films-2010 horror films-2010s comedy horror films-2010s science fiction horror films-American comedy horror films-American films-American science fiction comedy films-American science fiction horror films-American sequel films-English-language films-Films shot in New York City,na,Greg Lamberson,na,Greg Lamberson,English
Black Rat (film),65808580,"Black Rat (Japanese: クロネズミ, Hepburn: Kuronezumi) is a 2010 Japanese slasher film directed by Kenta Fukasaku. It stars Misaki Yonemura, Hiroya Matsumoto, and . The film's plot follows six high school students who receive mysterious messages asking them to meet in a classroom at midnight, after which they are targeted by a figure wearing a schoolgirl uniform and a rat mask.",Misaki Yonemura--Hiroya Matsumoto--Rina Saito,Black Rat,2010 films-2010 horror films-2010s Japanese films-2010s slasher films-Films about suicide-Japanese films-Japanese films about revenge-Japanese horror films-Japanese slasher films,na,Kenta Fukasaku,na,Kenta Fukasaku,Japanese
Two Eyes Staring,38406633,Two Eyes Staring originally titled Zwart Water is a 2010 Dutch horror film directed by Elbert van Strien and co-written by van Strien and Paulo van Vliet.,Hadewych Minis,Two Eyes Staring,2010 films-2010 horror films-Dutch horror films,na,na,na,na,Dutch
Death Bell 2: Bloody Camp,29203494,Death Bell 2: Bloody Camp (Korean: 고死 두번째 이야기 : 교생실습; RR: Gosa dubeonjjae iyagi : Gyosaengsilseup) is a 2010 Korean slasher film. It was directed by Yoo Sun-dong and is a sequel to the 2008 film Death Bell. The story is unrelated to the previous film.,Hwang Jung-eum--Kim Su-ro--Park Eun-bin--Park Ji-yeon--Son Ho-jun--Yoon Seung-ah--Yoon Shi-yoon,Death Bell 2: Bloody Camp,2010 films-2010 horror films-Korean-language films-South Korean films-South Korean horror films,na,na,na,na,Korean
Cyrus: Mind of a Serial Killer,33507904,"Cyrus, longer title Cyrus: Mind of a Serial Killer is a 2010 thriller horror film based on real events, written and directed by Mark Vadik and starring Brian Krause, Lance Henriksen and Danielle Harris.",--Brian Krause--Danielle Harris--Lance Henriksen,Cyrus,2010 films-2010 horror films-2010 horror thriller films-2010s serial killer films-American films-American horror thriller films-American serial killer films-English-language films-Films scored by Frederik Wiedmann-Films shot in Michigan,na,na,na,na,English
Dante's Inferno: Abandon All Hope,31993638,Dante's Inferno: Abandon All Hope is a 2010 black and white film produced and directed by Boris Acosta. The story is based on the first part of Dante Alighieri's Divine Comedy - Inferno.,Jenn Gotzon--Lalo Cibelli--Vittorio Matteucci--Armand Mastroianni--Diane Salinger--Jsu Garcia--Martin Kove--Nia Peeples--Stella Stevens--Vincent Spano,Dante's Inferno: Abandon All Hope,2010s American animated films-American films-English-language films-Films based on works by Dante Alighieri-Italian-language films-Purgatory in fiction,na,na,na,na,Italian
Orr Eravuu,19384107,"Orr Eravuu (Tamil: ஓர் இரவு; English: One night) is a 2010 Tamil independent horror film directed by three debutants, Hari Shankar, Hareesh Narayan and Krishna Sekhar. The film is about Paranormal occurrences. Spirits and ghosts are believed to have a close kinship with the night. Based on this concept Orr Eravuu was made. The entire film was shot from the protagonist's viewpoint, using shaky camerawork, reportedly the first Indian viewpoint film.",Sathish. G,Orr Eravuu,2010 directorial debut films-2010 films-2010 horror films-2010s Tamil-language films-Films shot in Munnar-Indian films-Indian horror films,na,na,na,na,Tamil
