film,number,abstract,starring,name,subjects,cinematography,director,gross,producer,language
Resident Evil: Afterlife,15332396,"Resident Evil: Afterlife is a 2010 action horror film written and directed by Paul W. S. Anderson. The film marks Anderson's return to direct in the Resident Evil film series, after the first film. A direct sequel to Resident Evil: Extinction (2007), it is the fourth installment in the Resident Evil film series, which is loosely based on the video game series of the same name, and the first to be shot in 3D. It stars Milla Jovovich, Ali Larter, Kim Coates, Shawn Roberts, Spencer Locke, Boris Kodjoe, and Wentworth Miller.",--Ali Larter--Boris Kodjoe--Kacey Clarke--Kim Coates--Milla Jovovich--Sergio Peris-Mencheta--Shawn Roberts--Spencer Locke--Wentworth Miller,Resident Evil: Afterlife,2010 3D films-2010 action thriller films-2010 films-2010 horror films-2010s science fiction horror films-Apocalyptic films-Canadian films-Canadian post-apocalyptic films-Canadian science fiction action films-Constantin Film films-English-language German films-English-language films-Films about cloning-Films about viral outbreaks-Films directed by Paul W. S. Anderson-Films produced by Don Carmody-Films scored by Tomandandy-Films set in Alaska-Films set in Los Angeles-Films set in Tokyo-Films set on ships-Films shot in Tokyo-Films shot in Toronto-Films with screenplays by Paul W. S. Anderson-French action horror films-French action thriller films-French films-French post-apocalyptic films-German action horror films-German action thriller films-German films-German post-apocalyptic films-German science fiction action films-German sequel films-Girls with guns films-IMAX films-Resident Evil (film series)-Screen Gems films,Glen MacPherson,Paul W. S. Anderson,3.002E8,Paul W. S. Anderson,English
Black Death (film),23887068,"Black Death is a 2010 German–British action horror film directed by Christopher Smith from an original screenplay by Dario Poloni. It stars Sean Bean, Eddie Redmayne and Carice van Houten. Despite not being credited as a writer, Smith made very significant changes in the second half of the script, including a new ending. All the scenes of Black Death were shot in chronological order, a rare occurrence.",--Andy Nyman--Carice van Houten--Eddie Redmayne--John Lynch--Kimberley Nixon--Sean Bean--Tim McInnerny,Black Death,Films directed by Christopher Smith-Films set in the 14th century-Folk horror films-Latin-language films,na,Christopher Smith (director),272445.0,Christopher Smith (director),Latin
Saw 3D,24341999,"Saw 3D (also known as Saw: The Final Chapter) is a 2010 American 3D horror film directed by Kevin Greutert and written by Patrick Melton and Marcus Dunstan. It is the seventh installment in the Saw film series. The film stars Tobin Bell, Costas Mandylor, Betsy Russell, Sean Patrick Flanery, and Cary Elwes. It also featured the final film appearance of Chester Bennington before his death in 2017. The plot follows a man who, after falsely claiming to be a survivor of one of the Jigsaw Killer's games in order to become a local celebrity, finds himself part of a real game where he must save his wife. Meanwhile, Jill Tuck informs the Internal Affairs that rogue Detective Mark Hoffman is the man responsible for the recent Jigsaw games, and Hoffman hunts her down.",--Betsy Russell--Cary Elwes--Costas Mandylor--Sean Patrick Flanery--Tobin Bell,Saw 3D Original Motion Picture Soundtrack,2010 3D films-2010 films-2010 horror films-2010s serial killer films-American 3D films-American films-American sequel films-American serial killer films-Censored films-Crime horror films-English-language films-Films directed by Kevin Greutert-Films scored by Charlie Clouser-Films shot in Toronto-Lionsgate films-Saw (franchise) films-Torture in films,na,Kevin Greutert,1.362E8,Kevin Greutert,English
Saw 3D,24341999,"Saw 3D (also known as Saw: The Final Chapter) is a 2010 American 3D horror film directed by Kevin Greutert and written by Patrick Melton and Marcus Dunstan. It is the seventh installment in the Saw film series. The film stars Tobin Bell, Costas Mandylor, Betsy Russell, Sean Patrick Flanery, and Cary Elwes. It also featured the final film appearance of Chester Bennington before his death in 2017. The plot follows a man who, after falsely claiming to be a survivor of one of the Jigsaw Killer's games in order to become a local celebrity, finds himself part of a real game where he must save his wife. Meanwhile, Jill Tuck informs the Internal Affairs that rogue Detective Mark Hoffman is the man responsible for the recent Jigsaw games, and Hoffman hunts her down.",--Betsy Russell--Cary Elwes--Costas Mandylor--Sean Patrick Flanery--Tobin Bell,Saw 3D,2010 3D films-2010 films-2010 horror films-2010s serial killer films-American 3D films-American films-American sequel films-American serial killer films-Censored films-Crime horror films-English-language films-Films directed by Kevin Greutert-Films scored by Charlie Clouser-Films shot in Toronto-Lionsgate films-Saw (franchise) films-Torture in films,na,Kevin Greutert,1.362E8,Kevin Greutert,English
Bear (2010 film),25590057,Bear is a 2010 American natural horror film directed by Roel Reiné (under the pseudonym of John Rebel) and starring Patrick Scott Lewis and Katie Lowes. The film centers on four people who become the target of an extremely aggressive and wrathful grizzly bear.,Brendan Michael Coughlin--Katie Lowes--Mary Alexandra Stiefvater,Bear,2010 directorial debut films-2010 films-2010 horror films-American films-American independent films-American natural horror films-English-language films-Films about bears-Films shot in California-Films with screenplays by Ethan Wiley-Grizzly bears in popular culture,Roel Reiné,Roel Reiné,na,Roel Reiné,English
Stricken (2010 film),22581010,"Stricken is an American film that premiered on June 25, 2010, It was directed and written by , the movie starred Stephanie French and David Fine of Rent, Sweet November, The Pursuit of Happiness, and many other films. It is based on the short film of the same name that won Best Sound Design at the Action On Film Festival in 2007, and its screenplay won Best Adapted Screenplay in 2008.",Stephanie French--David Fine (actor),Stricken,2010 films-2010 horror films-American films-American horror films-English-language films-Features based on short films,Matthew Sconce,Matthew Sconce,na,Matthew Sconce,English
Blood Junkie,41446378,"Blood Junkie (originally filmed under the working title Rocky Trails) is a 2010 American independent comedy slasher film written and directed by Drew Rosas and starring Nick Sommer, Mike Johnson, Emily Treolo, and Sarah Luther. The film was released on May 20, 2010 in Milwaukee, Wisconsin and was later released on DVD through Troma Entertainment in 2011. The film follows a group of teenagers who go out into the woods to get high but end up getting killed one by one.","Nick Sommer, Mike Johnson, Sarah Luther, Emily Treolo, Andrew Swant",Blood Junkie,2010 comedy films-2010 comedy horror films-2010 films-2010 horror films-2010s slasher films-American exploitation films-American films-American slasher films-Parodies of horror-Slasher comedy films-Troma Entertainment films,Drew Rosas,Drew Rosas,na,Drew Rosas,English
Dante's Inferno: An Animated Epic,25744220,"Dante's Inferno: An Animated Epic is a direct to DVD animated dark fantasy action film released on February 9, 2010. Based on Dante's Inferno video game which is itself loosely based on Dante's Inferno, Dante must travel through the circles of Hell and battle demons, creatures, monsters, and even Lucifer himself to save his beloved Beatrice.",--Graham McTavish--Peter Jessop,Dante's Inferno: An Animated Epic,2010 animated films-2010 anime films-2010 direct-to-video films-2010 films-2010 horror films-2010s American animated films-2010s action horror films-2010s fantasy action films-American action horror films-American adult animated films-American animated horror films-American anthology films-American dark fantasy films-American films-American horror anthology films-Animated films based on video games-Anime films based on video games-Demons in film-English-language films-Fantasy anthology films-Film Roman films-Films based on works by Dante Alighieri-Films set in hell-Greco-Roman mythology in popular culture-Horror anime and manga-Japanese action horror films-Japanese animated fantasy films-Japanese animated horror films-Japanese anthology films-Japanese dark fantasy films-Japanese films-Limbo-Manglobe-Production I.G-Purgatory in fiction-South Korean animated horror films-South Korean films-The Devil in film-Works based on Electronic Arts video games,na,Yasuomi Umetsu,na,Yasuomi Umetsu,English
Dark Relic,55835281,Dark Relic is a 2010 fantasy horror television film directed by and starring James Frain. The film was generally poorly received.,--Alyy Khan--Christian Cooke--Clemency Burton-Hill--James Frain--Marija Karan--Samuel West--Tom Basden,Dark Relic,2010 fantasy films-2010 films-2010 horror films-2010 television films-American fantasy films-American films-American supernatural horror films-Crusades films-Films set in Israel-Films set in Jerusalem-Films set in the 11th century,na,Lorenzo Sena,na,Lorenzo Sena,http://dbpedia.org/resource/English_language
Exquisite Corpse (film),31574831,"Exquisite Corpse is a 2010 horror film written and directed by Scott David Russell. It stars Steve Sandvoss, Nicole Vicius and Guillermo Díaz.",Guillermo Díaz (actor)--Nicole Vicius--Steve Sandvoss--Tessa Thompson,Exquisite Corpse,2010 films-2010 horror films-2010s science fiction horror films-American films-American science fiction horror films-American zombie films,na,Scott David Russell,na,Scott David Russell,English
Cinco (film),27809735,"Cinco (lit. 'Five') is a 2010 Philippine psychological supernatural comedy science fiction horror film produced and released by Star Cinema. The film consists of five different horror stories which each featuring an ensemble cast including Sam Concepcion, AJ Perez, Robi Domingo, Jodi Sta. Maria, Maja Salvador, Rayver Cruz, Mariel Rodriguez, Pokwang and Zanjoe Marudo and are directed by Frasco Mortiz, Enrico C. Santos, Ato Bautista, Nick Olanka, and Cathy Garcia-Molina. The film was released on July 14, 2010.",--AJ Perez--Jodi Sta. Maria--Maja Salvador--Mariel Rodriguez--Pokwang--Rayver Cruz--Robi Domingo--Sam Concepcion--Zanjoe Marudo,Cinco,2010 films-2010 horror films-English-language films-Films directed by Cathy Garcia-Molina-Philippine comedy horror films-Philippine films-Philippine psychological horror films-Philippine psychological thriller films-Philippine supernatural horror films-Philippine thriller drama films-Star Cinema films-Tagalog-language films-Zombie comedy films,na,Cathy Garcia-Molina,na,Cathy Garcia-Molina,Filipino
Devil's Playground (2010 film),28252265,"Devil's Playground is a British horror film directed by Mark McQueen and starring Craig Fairbrass. Intandem Films has the worldwide rights to the film, which was produced by Freddie Hutton-Mills, Bart Ruspoli and Jonathan Sothcott.",--Craig Fairbrass--Danny Dyer--Jaime Murray--MyAnna Buring,Devil's Playground,2010 films-2010 horror films-2010s monster movies-British films-English-language films-Films set in London,na,na,na,na,English
Paranormal Activity 2: Tokyo Night,32386989,"Paranormal Activity 2: Tokyo Night (Japanese: パラノーマル・アクティビティ 第2章 TOKYO NIGHT, Hepburn: Paranōmaru Akutibiti Dai Ni Shō: Tōkyō Naito) is a 2010 Japanese independent supernatural horror film written and directed by Toshikazu Nagae. Commissioned by the Japanese distributor Presidio Corporation, the film is based on the 2007 American film Paranormal Activity by Oren Peli and documents events that follow from the original film. Paranormal Activity 2: Tokyo Night was screened at various locations across Japan by Cinema Sunshine. It was later screened in various other countries.",Aoi Nakamura--Noriko Aoyama,Paranormal Activity 2: Tokyo Night,2010 films-2010 horror films-2010 independent films-2010 psychological thriller films-Alternative sequel films-Camcorder films-Demons in film-Films set in Tokyo-Found footage films-Japanese-language films-Japanese films-Japanese haunted house films-Japanese independent films-Japanese psychological horror films-Japanese psychological thriller films-Japanese supernatural horror films,na,na,4.16E7,na,Japanese
Rammbock: Berlin Undead,42272956,"Rammbock (also Rammbock: Berlin Undead and Siege of the Dead) is a 2010 German horror film directed by Marvin Kren, written by Benjamin Hessler, and starring Michael Fuith, Theo Trebs, Anka Graczyk, and Emily Cox as survivors of a rage virus in Berlin. Besides its native Germany, it was theatrically released in Austria, the UK, and the US.",--Anka Graczyk--Emily Cox--Michael Fuith--Theo Trebs,Rammbock,2010 directorial debut films-2010 films-2010 horror films-Austrian horror films-Films about viral outbreaks-Films about zombies-Films set in Berlin-German-language films-German films-German horror films-German independent films,na,Marvin Kren,na,Marvin Kren,German
The Quiet Ones (2010 film),40006699,"The Quiet Ones, also known as Hush, is a 2010 American independent horror film directed by . The film stars Courtney Gains, Reggie Bannister, Bill Allen, Adam C. Edwards and others.","Bill Allen--Reggie Bannister,--Courtney Gains",The Quiet Ones,2010 films-2010 horror films,na,Amel J. Figueroa,na,Amel J. Figueroa,English
Psych 9,28996885,Psych: 9 is a 2010 American-Czech horror film directed by Andrew Shortell. It stars Sara Foster and Michael Biehn.,--Cary Elwes--Michael Biehn--Sara Foster,Psych 9,2010 films-2010 horror films-American films-American horror films-Czech films-Czech horror films-English-language films-Films shot in the Czech Republic,na,na,na,na,English
Dante's Inferno: Abandon All Hope,31993638,Dante's Inferno: Abandon All Hope is a 2010 black and white film produced and directed by Boris Acosta. The story is based on the first part of Dante Alighieri's Divine Comedy - Inferno.,Jenn Gotzon--Lalo Cibelli--Vittorio Matteucci--Armand Mastroianni--Diane Salinger--Jsu Garcia--Martin Kove--Nia Peeples--Stella Stevens--Vincent Spano,Dante's Inferno: Abandon All Hope,2010 directorial debut films-2010 films-2010 horror films-2010s American animated films-American films-English-language films-Films based on works by Dante Alighieri-Italian-language films-Purgatory in fiction,na,na,na,na,English
Altitude (film),28253090,"Altitude is a Canadian horror, television and direct-to-video film directed by Canadian comic book writer and artist Kaare Andrews. Anchor Bay Entertainment distributed the film in North America, UK, Australia, and New Zealand. The trailer for Altitude premiered at the 2010 San Diego Comic Con.",Jake Weary--Jessica Lowndes--Julianna Guill--Landon Liboiron--Ryan Donowho,Altitude,2010 films-2010 horror films-2010s monster movies-2010s mystery films-2010s science fiction horror films-Canadian aviation films-Canadian films-Canadian mystery films-Canadian science fiction horror films-Canadian survival films-English-language films-Films set on airplanes-Films shot in British Columbia-Mystery horror films,na,Kaare Andrews,na,Kaare Andrews,na
Shelter (2010 film),18716405,"Shelter is a 2010 American supernatural thriller horror film directed by Måns Mårlind and Björn Stein, written by Michael Cooney, and starring Julianne Moore and Jonathan Rhys Meyers. The film was released as 6 Souls in the United States on 1 March 2013, for video on demand, followed by a limited theatrical release on 5 April 2013.",Brooklynn Proulx--Frances Conroy--Jeffrey DeMunn--Jonathan Rhys Meyers--Julianne Moore--Nathan Corddry,Shelter,2010 films-2010 horror films-American films-American supernatural horror films-American supernatural thriller films-English-language films-Films directed by Björn Stein-Films directed by Måns Mårlind-Films scored by John Frizzell (composer)-Films shot in Pennsylvania-Films shot in Pittsburgh,Linus Sandgren,Måns Mårlind,3200000.0,Måns Mårlind,English
The Last Exorcism,26588977,"The Last Exorcism is a 2010 American found footage supernatural horror film directed by Daniel Stamm. It stars Patrick Fabian, Ashley Bell, Iris Bahr, and Louis Herthum. After years of performing exorcisms, a disillusioned evangelical minister decides to participate in a documentary chronicling his last exorcism while exposing the fraud of his ministry. After receiving a letter from a farmer asking for help in driving out the devil, he meets the farmer's afflicted daughter.The film received positive reviews from critics and was a box office success, grossing more than $67 million against a $1.8 million budget.",Ashley Bell (actress)--Patrick Fabian,The Last Exorcism,"2010s supernatural films-American supernatural horror films-Baton Rouge, Louisiana-Camcorder films-English-language films-Films about exorcism-Films produced by Eli Roth-Films produced by Marc Abraham-Films scored by Nathan Barr-Films set in Louisiana-Films shot in Louisiana-Films shot in New Orleans-Found footage films-StudioCanal films-Vivendi franchises",na,Daniel Stamm,6.77E7,Daniel Stamm,English
30 Days of Night: Dark Days,24746257,"30 Days of Night: Dark Days is a 2010 direct-to-video American horror film based on the comic book miniseries of the same name. It was directed by and written by Ben Ketai, alongside co-writer Steve Niles. It is a sequel to the 2007 film 30 Days of Night. A prequel to the first film titled 30 Days of Night: Blood Trails was released on FEARnet.com and FEARnet On Demand in 2007 and was followed by a second series, 30 Days of Night: Dust to Dust.",Diora Baird--Harold Perrineau--Kiele Sanchez--Mia Kirshner--Rhys Coiro,30,2010 films-2010 horror films-30 Days of Night-American direct-to-video films-American films-American supernatural horror films-Apocalyptic films-Direct-to-video sequel films-English-language films-Films based on American comics-Films set in Alaska-Films set in Los Angeles-Films set on ships-Films shot in Vancouver-Ghost House Pictures films-IDW Publishing adaptations-Sony Pictures direct-to-video films-Stage 6 Films films-Vampires in film,na,Ben Ketai,na,Ben Ketai,English
Satan Hates You,30732491,Satan Hates You is a 2010 American horror film written and directed by James Felix McKenney.,Christine Spencer--Don Wood--Angus Scrimm--Bradford Scobie--John Levene--Larry Fessenden--Reggie Bannister,Satan Hates You,2010 films-2010 horror films-American films-American supernatural horror films-Demons in film,na,James Felix McKenney,na,James Felix McKenney,English
Scared Shrekless,24569006,"Scared Shrekless is a 26-minute computer-animated Halloween horror comedy television special, set shortly after the events of Shrek Forever After, that premiered on the American television network NBC on Thursday, October 28, 2010. Scared Shrekless was based on the children's book Shrek!, by the writer William Steig, which was published on October 17, 1990.",Antonio Banderas--Aron Warner--Cameron Diaz--Christopher Knights--Cody Cameron--Conrad Vernon--Dean Edwards--Kristen Schaal--Mike Myers,Scared Shrekless,2010 horror films-2010s American animated films-2010s animated television specials-2010s comedy horror films-American comedy horror films-American films-American supernatural horror films-American television films-Comedy short films-DreamWorks Animation animated short films-Films about Halloween-Films directed by Gary Trousdale-Films with screenplays by Gary Trousdale-Halloween television specials-Horror short films-NBC television specials-Shrek mass media,na,Gary Trousdale,na,Gary Trousdale,English
The Child's Eye,28829559,"The Child's Eye (Chinese: 童眼) is a 2010 Hong Kong horror film by the Pang brothers. It takes place in 2008 in Bangkok where six find themselves at the Chung Tai Hotel. After Rainie (Rainie Yang) sees a female ghost and Ling (Elanne Kwong) finds a disembodied hand, they find that while at dinner, the three men they came with have disappeared. Rainie leads the girls to find their friends.",--Ciwi Lam--Rex Ho--Elanne Kwong--Jeremy Tsui--Jo Koo--Lam Ka-tung--Rainie Yang--Shawn Yue,The Child's Eye,2010 3D films-2010 horror films-Films set in 2008-Foreign films shot in Thailand-Hong Kong 3D films-Hong Kong films-Hong Kong supernatural horror films,na,Pang brothers,na,Pang brothers,Mandarin
Cinco (film),27809735,"Cinco (lit. 'Five') is a 2010 Philippine psychological supernatural comedy science fiction horror film produced and released by Star Cinema. The film consists of five different horror stories which each featuring an ensemble cast including Sam Concepcion, AJ Perez, Robi Domingo, Jodi Sta. Maria, Maja Salvador, Rayver Cruz, Mariel Rodriguez, Pokwang and Zanjoe Marudo and are directed by Frasco Mortiz, Enrico C. Santos, Ato Bautista, Nick Olanka, and Cathy Garcia-Molina. The film was released on July 14, 2010.",--AJ Perez--Jodi Sta. Maria--Maja Salvador--Mariel Rodriguez--Pokwang--Rayver Cruz--Robi Domingo--Sam Concepcion--Zanjoe Marudo,Cinco,2010 films-2010 horror films-English-language films-Films directed by Cathy Garcia-Molina-Philippine comedy horror films-Philippine films-Philippine psychological horror films-Philippine psychological thriller films-Philippine supernatural horror films-Philippine thriller drama films-Star Cinema films-Tagalog-language films-Zombie comedy films,na,Cathy Garcia-Molina,na,Cathy Garcia-Molina,
Cinco (film),27809735,"Cinco (lit. 'Five') is a 2010 Philippine psychological supernatural comedy science fiction horror film produced and released by Star Cinema. The film consists of five different horror stories which each featuring an ensemble cast including Sam Concepcion, AJ Perez, Robi Domingo, Jodi Sta. Maria, Maja Salvador, Rayver Cruz, Mariel Rodriguez, Pokwang and Zanjoe Marudo and are directed by Frasco Mortiz, Enrico C. Santos, Ato Bautista, Nick Olanka, and Cathy Garcia-Molina. The film was released on July 14, 2010.",--AJ Perez--Jodi Sta. Maria--Maja Salvador--Mariel Rodriguez--Pokwang--Rayver Cruz--Robi Domingo--Sam Concepcion--Zanjoe Marudo,Cinco,2010 films-2010 horror films-English-language films-Films directed by Cathy Garcia-Molina-Philippine comedy horror films-Philippine films-Philippine psychological horror films-Philippine psychological thriller films-Philippine supernatural horror films-Philippine thriller drama films-Star Cinema films-Tagalog-language films-Zombie comedy films,na,Cathy Garcia-Molina,na,Cathy Garcia-Molina,English
Basement (2010 film),27615444,"Basement is a 2010 British horror film, starring Danny Dyer and written by Ewen Glass about six friends who are lured into a basement for a sinister experiment.",Danny Dyer--Emily Beecham--Jimi Mistry,Basement,2010 films-2010 horror films-British films-British horror films-English-language films,na,na,na,na,English
The Pack (2010 film),27477193,"The Pack (French: La meute) is a 2010 Franco-Belgian horror film directed and written by Franck Richard. It stars Yolande Moreau, Philippe Nahon, Émilie Dequenne and Benjamin Biolay. The film is about Charlotte and Max who come across a restaurant. After Max disappears, Charlotte returns later to find him and gets herself trapped in a cage by the restaurant owner, who has a pack of cannibals with her. The film premiered at the Cannes Film Festival on 15 May 2010 and was first shown in North America at the Fantasia Festival. The film has received generally mixed reviews.",Benjamin Biolay--Philippe Nahon--Yolande Moreau--Émilie Dequenne,The Pack,2010 directorial debut films-2010 films-2010 horror films-French-language films-French films-French horror films-French zombie films,na,Franck Richard,275.0,Franck Richard,French
Mendhamuge Evaguthu,60590619,"Mendhamuge Evaguthu is a 2010 Maldivian horror film written and directed by Yoosuf Shafeeu and Amjad Ibrahim. Produced by Hussain Rasheed, the film stars Yoosuf Shafeeu, Fathimath Fareela, Ali Fizam and Amira Ismail in pivotal roles.",Ahmed Fizam--Amira Ismail--Fathimath Fareela--Yoosuf Shafeeu,Mendhamuge Evaguthu,2010 films-2010 horror films-Maldivian films-Maldivian horror films,na,Yoosuf Shafeeu,na,Yoosuf Shafeeu,Dhivehi
Curse of the Deserted,46314193,"Curse of the Deserted is a 2010 Chinese horror film directed by Law Chi-leung and written by Cheung Chi-Kwong and Cai Jun, and starring Shawn Yue, Zhang Yuqi, Fu Miao, and Yue Xiaojun. The film is an adaptation of Cai Jun's novel of the same name.",Fu Miao--Yue Xiaojun--Shawn Yue--Zhang Yuqi,Curse of the Deserted,2010 films-2010 horror films-Chinese films-Chinese horror films-Films based on Chinese novels,na,Law Chi-leung,na,Law Chi-leung,Mandarin
Rare Exports: A Christmas Tale,29012574,"Rare Exports: A Christmas Tale is a 2010 Finnish fantasy film written and directed by Jalmari Helander about people living near Korvatunturi who discover the secret behind Santa Claus. The film is based on the 2003 short film Rare Exports Inc. and its 2005 sequel Rare Exports: The Official Safety Instructions by Jalmari Helander and Juuso Helander, both of which involve a company that traps wild Santa Clauses and trains and exports them to locations around the world.",--Ilmari Järvenpää--Jonathan Hutchings--Jorma Tommila--Onni Tommila--Peeter Jakobi--Per Christian Ellefsen--Rauno Juvonen--Risto Salmi--Tommi Korpela,Rare Exports: A Christmas Tale,2010 films-2010 horror films-2010 horror thriller films-2010s Christmas films-2010s Christmas horror films-2010s fantasy films-Christmas horror films-Dark fantasy films-English-language films-Features based on short films-Films directed by Jalmari Helander-Films set in Finland-Finnish-language films-Finnish Christmas films-Finnish films-Finnish horror films-Icon Productions films-Santa Claus in film-Scanbox Entertainment films,na,Jalmari Helander,na,Jalmari Helander,Finnish
