,film,number,abstract,starring,name,subjects,cinematography,director,gross,producer,language
21,Taken 3,38964482,"Taken 3 (sometimes stylized as Tak3n) is a 2014 English-language French action-thriller film directed by Olivier Megaton and written by Luc Besson and Robert Mark Kamen. It is the third and final installment in the Taken trilogy. A co-production between France, Spain and the United States, the film stars Liam Neeson, Forest Whitaker, Maggie Grace and Famke Janssen.",Dougray Scott-Famke Janssen-Forest Whitaker-Leland Orser-Liam Neeson-Maggie Grace-Sam Spruell,Taken 3,2014 action thriller films-2014 films-20th Century Fox films-American action thriller films-American films-American films about revenge-American sequel films-Films produced by Luc Besson-French films about revenge-Spanish sequel films,na,Olivier Megaton,3.264E8,Olivier Megaton,English
22,Taken 3,38964482,"Taken 3 (sometimes stylized as Tak3n) is a 2014 English-language French action-thriller film directed by Olivier Megaton and written by Luc Besson and Robert Mark Kamen. It is the third and final installment in the Taken trilogy. A co-production between France, Spain and the United States, the film stars Liam Neeson, Forest Whitaker, Maggie Grace and Famke Janssen.",Dougray Scott-Famke Janssen-Forest Whitaker-Leland Orser-Liam Neeson-Maggie Grace-Sam Spruell,Taken 3,EuropaCorp films-Films directed by Olivier Megaton-Films scored by Nathaniel Méchaly-Films shot in Georgia (U.S. state)-Films with screenplays by Luc Besson-Films with screenplays by Robert Mark Kamen-French action thriller films-French sequel films-French vigilante films-IMAX films-Spanish action thriller films-Spanish films-TSG Entertainment films-Taken (franchise),na,Olivier Megaton,3.264E8,Olivier Megaton,Russian
23,Waar 2,41305887,Waar 2 is an upcoming Pakistani action-thriller film directed and written by Hassan Rana. It is a sequel to the Bilal Lashari's directed 2013 film Waar. The film stars Shaan Shahid. Filming began in June 2015 in London.,-Agha Haris Durrani-Aleeze Nasser-Ayesha Omer-Bilal Ashraf-Maya Ali-Shaan Shahid,Waar 2,Films directed by Hassan Rana-Films shot in Gilgit-Baltistan-Films shot in London-MindWorks Media films-Pakistani action thriller films-Pakistani films-Pakistani spy thriller films-Unreleased Pakistani films,Hassan Rana,Hassan Rana,na,Hassan Rana,http://dbpedia.org/resource/Urdu
24,Force (film series),52409217,"Force is a series of Indian action-thriller films, produced by Vipul Amrutlal Shah. The first part directed by Nishikant Kamath released in 2011 and the second part directed by Abhinay Deo released in 2016. A third part of the series is in pre-production.",Genelia D'Souza-Sonakshi Sinha-John Abraham (actor)-Raj Babbar-Tahir Raj Bhasin-Vidyut Jamwal,Force series,Action film series-Fox Star Studios films-Hindi-language films-Indian film series-Viacom18 Studios films,Ayananka Bose,Nishikant Kamat,na,Nishikant Kamat,Hindi
25,Absolute Deception,38461562,"Absolute Deception (also known as Deception) is a 2013 Australian/Canadian international co-production action-thriller film directed by Brian Trenchard-Smith and starring Cuba Gooding Jr. and Emmanuelle Vaugier. The film was released on direct-to-DVD in the United States on June 11, 2013.",Cuba Gooding Jr.-Emmanuelle Vaugier,Absolute Deception,2013 action thriller films-2013 direct-to-video films-2013 films-Australian action adventure films-Australian action thriller films-Australian films-Canadian action thriller films-Canadian films-English-language films-Films set in Queensland-Films shot in Australia-Sony Pictures direct-to-video films-Voltage Pictures films,na,Brian Trenchard-Smith,na,Brian Trenchard-Smith,English
26,Jaal: The Trap,18372339,"Jaal: the trap is a 2003 Indian Hindi-language action-thriller film directed by Guddu Dhanoa. It stars Sunny Deol, Tabu, Reema Sen and Anupam Kher. It was released on 18 July 2003.",Anupam Kher-Reema Sen-Sunny Deol-Tabu (actress),Jaal: The Trap,2000s Hindi-language films-2003 action films-2003 films-Films scored by Anand Raj Anand-Films shot in New Zealand-Indian action films-Indian films-Kashmir conflict in films,na,Guddu Dhanoa,na,Guddu Dhanoa,http://dbpedia.org/resource/Hindi
27,Battle Royale (film),304692,"Battle Royale (バトル・ロワイアル, Batoru Rowaiaru) is a 2000 Japanese action-thriller film directed by Kinji Fukasaku, with a screenplay written by Kenta Fukasaku, based on the 1999 novel by Koushun Takami. Starring Tatsuya Fujiwara, Aki Maeda, Tarō Yamamoto, and Takeshi Kitano, the film follows a group of junior high-school students that are forced to fight to the death by the Japanese totalitarian government. The film drew controversy, and was banned or excluded from distribution in several countries; Toei Company refused to sell the film to any United States distributor for over a decade due to concerns about potential controversy and lawsuits, until Anchor Bay Entertainment eventually acquired the film in 2010 for a direct-to-video release.",-Aki Maeda-Chiaki Kuriyama-Kou Shibasaki-Masanobu Andō-Takeshi Kitano-Tarō Yamamoto-Tatsuya Fujiwara,Battle Royale Original Soundtrack,2000 action thriller films-2000 films-2000s dystopian films-Battle Royale (franchise)-Battle royale-Films about death games-Films based on Japanese novels-Films based on science fiction novels-Films based on thriller novels-Films directed by Kinji Fukasaku-Films scored by Masamichi Amano-Films set on fictional islands-Films set on uninhabited islands-Films shot in Tokyo-Girls with guns films-Japanese-language films-Japanese action thriller films-Japanese films-Obscenity controversies in film-Splatter films-Toei Company films,Katsumi Yanagishima,Kinji Fukasaku,3.06E7,Kinji Fukasaku,Japanese
28,A Good Day to Die Hard,34228306,"A Good Day to Die Hard is a 2013 American action-thriller film and the fifth installment in the Die Hard film series. The film was directed by John Moore and written by Skip Woods, and stars Bruce Willis as John McClane. The main plot finds McClane travelling to Russia to get his estranged son, Jack, an undercover CIA agent, out of prison. He is soon caught in the crossfire of a global terrorist plot. Alongside Willis, the film also stars Jai Courtney, Cole Hauser, Yulia Snigir and Sebastian Koch.",-Amaury Nolasco-Bruce Willis-Cole Hauser-Jai Courtney-Rasha Bukvić-Sebastian Koch-Sergei Kolesnikov-Yulia Snigir,A Good Day to Die Hard,"2013 action thriller films-2013 films-20th Century Fox films-American action thriller films-American films-American sequel films-Die Hard-English-language films-Films about families-Films about nuclear war and weapons-Films about terrorism in Europe-Films about the Central Intelligence Agency-Films directed by John Moore-Films produced by Wyck Godfrey-Films scored by Marco Beltrami-Films set in Moscow-Films set in New York City-Films set in Ukraine-Films set in Washington, D.C.-Films shot in Belgrade-Films shot in Budapest-Films with screenplays by Skip Woods-IMAX films-Russian-language films-TSG Entertainment films",Jonathan Sela,John Moore (director),3.047E8,John Moore (director),Russian
29,Jason Bourne (film),43844230,"Jason Bourne is a 2016 American action-thriller film directed by Paul Greengrass and written by Greengrass and Christopher Rouse. It is the fifth installment of the Bourne film series and a direct sequel to The Bourne Ultimatum (2007). Matt Damon reprises his role as the main character, former CIA assassin Jason Bourne. In addition, the film stars Tommy Lee Jones, Alicia Vikander, Julia Stiles, Vincent Cassel, Riz Ahmed, Ato Essandoh and Scott Shepherd.",-Alicia Vikander-Julia Stiles-Matt Damon-Riz Ahmed-Tommy Lee Jones-Vincent Cassel,Original Motion Picture Soundtrack,"2016 action thriller films-2016 films-American action thriller films-American films-American films about revenge-American sequel films-Bourne (film series)-Films about United States Army Special Forces-Films directed by Paul Greengrass-Films produced by Frank Marshall-Films produced by Matt Damon-Films scored by David Buckley-Films scored by John Powell-Films set in 1999-Films set in 2016-Films set in Athens-Films set in Berlin-Films set in Greece-Films set in London-Films set in Reykjavík-Films set in Rome-Films set in the Las Vegas Valley-Films shot at Warner Bros. Studios, Leavesden-Films shot in Berlin-Films shot in Greece-Films shot in London-Films shot in Washington, D.C.-Films shot in the Canary Islands-Films shot in the Las Vegas Valley-IMAX films-Malware in fiction-Perfect World Pictures films-The Kennedy/Marshall Company films-Universal Pictures films",Barry Ackroyd,Paul Greengrass,4.155E8,Paul Greengrass,English
30,The Girl in the Spider's Web (film),48465449,"The Girl in the Spider's Web is a 2018 action-thriller film directed by Fede Álvarez and written by Jay Basu, Álvarez, and Steven Knight, and based on the 2015 novel of the same name by David Lagercrantz, which in turn is based on characters in the Millennium book series by Stieg Larsson. The film acts as a sequel to David Fincher's The Girl with the Dragon Tattoo. It stars Claire Foy in the role of Lisbeth Salander and follows Salander as she battles against a mysterious notorious organization, the Spiders, who seek world dominance. Sverrir Gudnason, Lakeith Stanfield, Sylvia Hoeks, and Stephen Merchant also appear in the film.",-Claire Foy-LaKeith Stanfield-Stephen Merchant-Sverrir Gudnason-Sylvia Hoeks,The Girl in the Spider's Web,American crime action films-Films produced by Scott Rudin,na,Fede Álvarez,3.52E7,Fede Álvarez,English
31,Taken 3,38964482,"Taken 3 (sometimes stylized as Tak3n) is a 2014 English-language French action-thriller film directed by Olivier Megaton and written by Luc Besson and Robert Mark Kamen. It is the third and final installment in the Taken trilogy. A co-production between France, Spain and the United States, the film stars Liam Neeson, Forest Whitaker, Maggie Grace and Famke Janssen.",Dougray Scott-Famke Janssen-Forest Whitaker-Leland Orser-Liam Neeson-Maggie Grace-Sam Spruell,Taken 3,2014 action thriller films-2014 films-20th Century Fox films-American action thriller films-American films-American films about revenge-American sequel films-English-language French films-English-language films-Films produced by Luc Besson-Films set in Afghanistan-Films set in Los Angeles-Films shot in Los Angeles-French films-French films about revenge-IMAX films-Spanish sequel films,na,Olivier Megaton,3.264E8,Olivier Megaton,Russian
32,The Rage (1997 film),25829160,The Rage is a 1997 Canadian-American action-thriller film directed by Sidney J. Furie.,David Carradine-Gary Busey-Kristen Cloke-Lorenzo Lamas-Roy Scheider,The Rage,1997 action thriller films-1997 films-American action thriller films-American films-Films directed by Sidney J. Furie,Donald M. Morgan,Sidney J. Furie,na,Sidney J. Furie,English
33,Battle Royale (film),304692,"Battle Royale (バトル・ロワイアル, Batoru Rowaiaru) is a 2000 Japanese action-thriller film directed by Kinji Fukasaku, with a screenplay written by Kenta Fukasaku, based on the 1999 novel by Koushun Takami. Starring Tatsuya Fujiwara, Aki Maeda, Tarō Yamamoto, and Takeshi Kitano, the film follows a group of junior high-school students that are forced to fight to the death by the Japanese totalitarian government. The film drew controversy, and was banned or excluded from distribution in several countries; Toei Company refused to sell the film to any United States distributor for over a decade due to concerns about potential controversy and lawsuits, until Anchor Bay Entertainment eventually acquired the film in 2010 for a direct-to-video release.",-Aki Maeda-Chiaki Kuriyama-Kou Shibasaki-Masanobu Andō-Takeshi Kitano-Tarō Yamamoto-Tatsuya Fujiwara,Battle Royale,2000 action thriller films-2000 films-2000s dystopian films-Battle Royale (franchise)-Battle royale-Films about death games-Films based on Japanese novels-Films based on science fiction novels-Films based on thriller novels-Films directed by Kinji Fukasaku-Films scored by Masamichi Amano-Films set on fictional islands-Films set on uninhabited islands-Films shot in Tokyo-Girls with guns films-Japanese-language films-Japanese action thriller films-Japanese films-Obscenity controversies in film-Splatter films-Toei Company films,Katsumi Yanagishima,Kinji Fukasaku,3.06E7,Kinji Fukasaku,Japanese
34,A Good Day to Die Hard,34228306,"A Good Day to Die Hard is a 2013 American action-thriller film and the fifth installment in the Die Hard film series. The film was directed by John Moore and written by Skip Woods, and stars Bruce Willis as John McClane. The main plot finds McClane travelling to Russia to get his estranged son, Jack, an undercover CIA agent, out of prison. He is soon caught in the crossfire of a global terrorist plot. Alongside Willis, the film also stars Jai Courtney, Cole Hauser, Yulia Snigir and Sebastian Koch.",-Amaury Nolasco-Bruce Willis-Cole Hauser-Jai Courtney-Rasha Bukvić-Sebastian Koch-Sergei Kolesnikov-Yulia Snigir,A Good Day to Die Hard: Original Motion Picture Soundtrack,"2013 action thriller films-2013 films-20th Century Fox films-American action thriller films-American films-American sequel films-Die Hard-English-language films-Films about families-Films about nuclear war and weapons-Films about terrorism in Europe-Films about the Central Intelligence Agency-Films directed by John Moore-Films produced by Wyck Godfrey-Films scored by Marco Beltrami-Films set in Moscow-Films set in New York City-Films set in Ukraine-Films set in Washington, D.C.-Films shot in Belgrade-Films shot in Budapest-Films with screenplays by Skip Woods-IMAX films-Russian-language films-TSG Entertainment films",Jonathan Sela,John Moore (director),3.047E8,John Moore (director),English
35,Jason Bourne (film),43844230,"Jason Bourne is a 2016 American action-thriller film directed by Paul Greengrass and written by Greengrass and Christopher Rouse. It is the fifth installment of the Bourne film series and a direct sequel to The Bourne Ultimatum (2007). Matt Damon reprises his role as the main character, former CIA assassin Jason Bourne. In addition, the film stars Tommy Lee Jones, Alicia Vikander, Julia Stiles, Vincent Cassel, Riz Ahmed, Ato Essandoh and Scott Shepherd.",-Alicia Vikander-Julia Stiles-Matt Damon-Riz Ahmed-Tommy Lee Jones-Vincent Cassel,Jason Bourne,"2016 action thriller films-2016 films-American action thriller films-American films-American films about revenge-American sequel films-Bourne (film series)-Films about United States Army Special Forces-Films directed by Paul Greengrass-Films produced by Frank Marshall-Films produced by Matt Damon-Films scored by David Buckley-Films scored by John Powell-Films set in 1999-Films set in 2016-Films set in Athens-Films set in Berlin-Films set in Greece-Films set in London-Films set in Reykjavík-Films set in Rome-Films set in the Las Vegas Valley-Films shot at Warner Bros. Studios, Leavesden-Films shot in Berlin-Films shot in Greece-Films shot in London-Films shot in Washington, D.C.-Films shot in the Canary Islands-Films shot in the Las Vegas Valley-IMAX films-Malware in fiction-Perfect World Pictures films-The Kennedy/Marshall Company films-Universal Pictures films",Barry Ackroyd,Paul Greengrass,4.155E8,Paul Greengrass,English
36,What Happened to Monday,47404924,"What Happened to Monday (known in several territories as Seven Sisters) is a 2017 dystopian science-fiction action-thriller film directed by Tommy Wirkola and stars Noomi Rapace, Glenn Close and Willem Dafoe. It was written by Max Botkin and Kerry Williamson. The plot follows a family of identical septuplets (seven genetically identical girls) who live in a world where due to overpopulation each household is allowed only one child. When one of the sisters goes missing, the others must find her while remaining unknown to the outside world.",-Cassie Clare-Christian Rubeck-Glenn Close-Marwan Kenzari-Noomi Rapace-Pål Sverre Hagen-Tomiwa Edun-Willem Dafoe,What Happened to Monday,2010s science fiction thriller films-2017 films-2017 science fiction action films-American dystopian films-American films-American science fiction action films-American science fiction thriller films-Belgian action films-Belgian films-Belgian science fiction thriller films-British films-British science fiction action films-British science fiction thriller films-English-language films-Films directed by Tommy Wirkola-Films set in 2073-Films set in the 2070s-Films shot in Bucharest-Films shot in Romania-French films-French science fiction action films-French science fiction thriller films-Overpopulation fiction,na,Tommy Wirkola,2.8E7,Tommy Wirkola,English
37,Ambulance (film),65818039,"Ambulance is an upcoming American action-thriller film directed and produced by Michael Bay. Written by Chris Fedak, the film is based on the 2005 Danish film of the same name by Laurits Munch-Petersen, and stars Jake Gyllenhaal and Yahya Abdul-Mateen II as two bank robbers who steal an ambulance occupied by a paramedic (Eiza González), and a patient in critical condition. The film is scheduled to be theatrically released by Universal Pictures on February 18, 2022.",-Eiza González-Jake Gyllenhaal-Yahya Abdul-Mateen II,Ambulance,2022 action thriller films-American action thriller films-American films-American remakes of Danish films-Films about bank robbery-Films directed by Michael Bay-Films impacted by the COVID-19 pandemic-Films produced by James Vanderbilt-Films produced by Michael Bay-Films scored by Lorne Balfe-Films set in Los Angeles-Films shot in Los Angeles-Universal Pictures films-Upcoming films,na,Michael Bay,na,Michael Bay,English
38,Kaante,1792743,"Kaante (lit. 'Thorns') is a 2002 Indian Hindi-language action-thriller film directed by Sanjay Gupta, written by Milap Zaveri, and starring an ensemble cast including Amitabh Bachchan, Sanjay Dutt, Sunil Shetty, Lucky Ali, Mahesh Manjrekar, Kumar Gaurav, Namrata Singh Gujral, Rati Agnihotri, Rohit Roy, Isha Koppikar and Malaika Arora. Set in Los Angeles, the film follows six Indian men who are detained without evidence by the police. Feeling wronged and vengeful, they team up to plot a bank heist that would leave the Los Angeles Police Department penniless. However, once things go out of hand, they start suspecting each other's identities, resulting in violence and chaos.",Amitabh Bachchan-Isha Koppikar-Kumar Gaurav-Lucky Ali-Mahesh Manjrekar-Malaika Arora-Namrata Singh Gujral-Rati Agnihotri-Rohit Roy-Sanjay Dutt-Sunil Shetty,Kaante,2002 films-Fictional portrayals of the Los Angeles Police Department-Films directed by Sanjay Gupta-Films featuring an item number-Films scored by Anand Raj Anand-Films scored by Gregor Narholz-Films scored by Vishal–Shekhar-Films set in Los Angeles-Films set in the United States-Films shot in Los Angeles-Indian action thriller films-Indian films-Indian heist films-Indian remakes of American films,na,Sanjay Gupta (director),na,Sanjay Gupta (director),Hindi
39,Thunive Thunai,54203602,"Thunive Thunai is a 1976 Tamil-language action-thriller film, directed by S. P. Muthuraman and produced by P. V. Tholasiraman under his banner P. V. T. Productions. The film script was written by Panchu Arunachalam. Music was by M. S. Viswanathan. It stars Jaishankar, Jayaprabha and Rajasulochana, with S. A. Ashokan, Suruli Rajan and S. V. Ramadoss playing pivotal roles. The film was slightly inspired by the Hollywood classic Bad Day at Black Rock. This film was a Runaway hit at the box office.",Jayaprabha-Rajasulochana-S. A. Ashokan-Jaishankar,Thunive Thunai,1970s Tamil-language films-1970s action thriller films-1970s spy thriller films-Films about organised crime in India-Films directed by S. P. Muthuraman-Films scored by M. S. Viswanathan-Films with screenplays by Panchu Arunachalam-Indian action thriller films-Indian films-Indian spy thriller films-Mining in film,na,S. P. Muthuraman,na,S. P. Muthuraman,http://dbpedia.org/resource/Tamil_language
40,Sapoot,15451313,"Sapoot (transl. Worthy Son) is a 1996 Indian Hindi-language action-thriller film directed by Jagdish A. Sharma, starring Sunil Shetty, Akshay Kumar, Karishma Kapoor and Sonali Bendre. Other cast members include Kader Khan, Prem Chopra, Johnny Lever, Kiran Kumar, Avtar Gill, Mukesh Rishi, Shalini Kapoor, Jeetu Verma and Mahavir Shah. The film did average business at the box office, and its title track ‘Oye’ was a chartbuster.",Akshay Kumar-Karisma Kapoor-Sonali Bendre-Sunil Shetty,Sapoot,1990s Hindi-language films-1990s action drama films-1990s crime action films-1996 films-Films scored by Anu Malik-Indian action drama films-Indian crime action films-Indian films-Masala films,na,na,na,na,http://dbpedia.org/resource/Hindi
41,Annarth,23968034,"Annarth (transl. Disaster) is a 2002 Indian Hindi- language action-thriller film. The film stars Sanjay Dutt, Sunil Shetty, Ashutosh Rana and Preeti Jhangiani , as well as Tinnu Anand and Johnny Lever in supporting roles. The film also features the debut of Gautam Rode and the film also stars former cricketer of the Indian cricket team, Vinod Kambli.",Gautam Rode-Preeti Jhangiani-Sanjay Dutt-Sunil Shetty,Annarth,2000s Hindi-language films-2002 action thriller films-2002 films-Films scored by Anand Raj Anand-Indian action thriller films-Indian films-Indian gangster films-Masala films,na,na,na,na,Hindi
42,Eagle Eye,14090644,"Eagle Eye is a 2008 American action-thriller film directed by D. J. Caruso, written by John Glenn, Travis Adam Wright, Hillary Seitz and Dan McDermott, and stars Shia LaBeouf, Michelle Monaghan and Billy Bob Thornton. It follows two strangers who must go on the run together, after receiving a mysterious phone call from an unknown woman who uses information and communications technology to track them. The film premiered in traditional theaters and IMAX theaters on September 26, 2008 and grossed $178 million worldwide.",-Anthony Mackie-Billy Bob Thornton-Michael Chiklis-Michelle Monaghan-Rosario Dawson-Shia LaBeouf,Eagle Eye,"2000s mystery films-2008 action thriller films-2008 films-2008 science fiction films-American action thriller films-American chase films-American films-American mystery films-American science fiction action films-Cybernetted society in fiction-DreamWorks Pictures films-Drone films-English-language films-Films about Delta Force-Films about artificial intelligence-Films about computing-Films about fictional presidents of the United States-Films about security and surveillance-Films about terrorism-Films directed by D. J. Caruso-Films scored by Brian Tyler-Films set in 2009-Films set in Afghanistan-Films set in Balochistan, Pakistan-Films set in Chicago-Films set in Indianapolis-Films set in Washington, D.C.-Films shot in Chicago-IMAX films-Paramount Pictures films-Techno-thriller films-United States presidential succession in fiction-War in Afghanistan (2001–2021) films",Dariusz Wolski,D.J. Caruso,1.788E8,D.J. Caruso,English
43,Dhoom,1828869,"Dhoom (transl. Blast) is a 2004 Indian Hindi-language action-thriller film directed by Sanjay Gadhvi and written by Vijay Krishna Acharya and Aditya Chopra who also produced the film through the well known company Yash Raj Films.The film stars Abhishek Bachchan, Uday Chopra, John Abraham, Esha Deol and Rimi Sen. It is the first installment in the later famous Dhoom franchise. The cinematography was done by Nirav Shah, and the original soundtrack was composed by Pritam, while Salim-Sulaiman provided the background score for the film.","* Abhishek Bachchan              
* Uday Chopra
* John Abraham
* Esha Deol
* Rimi Sen",Dhoom,2000s Hindi-language films-2000s heist films-2004 action thriller films-2004 films-Fictional portrayals of the Maharashtra Police-Films directed by Sanjay Gadhvi-Films featuring songs by Pritam-Films set in Mumbai-Films shot in Mumbai-Indian action thriller films-Indian films-Indian heist films-Yash Raj Films films,Nirav Shah,Sanjay Gadhvi,na,Sanjay Gadhvi,Hindi
44,Taken 2,35874076,"Taken 2 is a 2012 English-language French action-thriller film directed by Olivier Megaton and starring Liam Neeson, Maggie Grace, Famke Janssen, Rade Šerbedžija, Leland Orser, Jon Gries, D.B. Sweeney and Luke Grimes. It follows Bryan Mills taking his family to Istanbul, only to be kidnapped, along with his ex-wife, by the father of one of the men he killed while saving his daughter two years prior.",Famke Janssen-Liam Neeson-Maggie Grace-Rade Šerbedžija,Taken 2,2010s chase films-2012 action thriller films-2012 films-20th Century Fox films-Albanian Mafia-American action thriller films-American films-American sequel films-English-language French films-English-language films-EuropaCorp films-Films about families-Films about kidnapping-Films directed by Olivier Megaton-Films produced by Luc Besson-Films scored by Nathaniel Méchaly-Films set in Albania-Films set in Istanbul-Films set in Los Angeles-Films set in Paris-Films shot in Istanbul-Films shot in Los Angeles-Films shot in Paris-Films shot in Turkey-Films with screenplays by Luc Besson-Films with screenplays by Robert Mark Kamen-French action thriller films-French films-French films about revenge-French sequel films-French vigilante films-Taken (franchise),na,Olivier Megaton,na,Olivier Megaton,English
