,film,number,abstract,starring,name,subjects,cinematography,director,gross,producer,language
45,Maanagara Kaaval,36344689,Maanagara Kaaval (transl. City Police) is a 1991 Tamil-language action-thriller film directed by M. Thiyagarajan. The film stars Vijayakanth and Suma. This is 150th film of AVM Productions. The movie was a blockbuster. It was dubbed in Telugu as City Police. The movie was based on the 1988 Malayalam movie August 1.,Senthil-Anandaraj-Lakshmi (actress)-M. N. Nambiar-Nassar (actor)-Suman Ranganathan-Vijayakanth,Maanagara Kaaval,1990s Tamil-language films-1990s political thriller films-1991 action thriller films-1991 films-Cultural depictions of Prime Ministers of India-Indian action thriller films-Indian films-Indian political thriller films,na,na,na,na,Tamil
46,The Wedding Guest (2018 film),58454641,"The Wedding Guest is a 2018 British-American action-thriller film written and directed by Michael Winterbottom. It stars Dev Patel, Radhika Apte and Jim Sarbh. It had its world premiere at the Toronto International Film Festival on September 8, 2018. It was released in the United States on March 1, 2019, by IFC Films.",Dev Patel-Jim Sarbh-Radhika Apte,The Wedding Guest,"2018 action thriller films-American action thriller films-American films-British action thriller films-British films-Films directed by Michael Winterbottom-Films set in Amritsar-Films set in Delhi-Films set in Goa-Films set in India-Films set in Jaipur-Films set in Lahore-Films set in Pakistan-Films set in Punjab, India-Films set in Punjab, Pakistan-Foreign films shot in India-IFC Films films-Stage 6 Films films",Giles Nuttgens,Michael Winterbottom,386166.0,Michael Winterbottom,English
47,Broken Arrow (1996 film),524813,"Broken Arrow is a 1996 American action-thriller film directed by John Woo, written by Graham Yost, and starring John Travolta, Christian Slater, and Samantha Mathis. The film's main themes include the theft of two American nuclear weapons, the attempts of U.S. military authorities to recover them, and the feud between Travolta and Slater's characters. The film was a commercial success despite mixed reviews.",-Bob Gunton-Christian Slater-Delroy Lindo-Frank Whaley-Howie Long-John Travolta-Samantha Mathis,Broken Arrow,1990s chase films-1990s spy films-1996 action thriller films-1996 films-20th Century Fox films-American action thriller films-American aviation films-American films-American spy films-Films about nuclear war and weapons-Films about terrorism in the United States-Films about the United States Air Force-Films directed by John Woo-Films scored by Hans Zimmer-Films set in Utah-Films shot in Montana-Neo-Western films-Rail transport films,Peter Levy (cinematographer),John Woo,na,John Woo,English
48,Northeast of Seoul,29894372,"Northeast of Seoul is a 1972 American action-thriller film directed by David Lowell Rich. It stars Anita Ekberg and John Ireland, with music by Alan Heyman.",Anita Ekberg-John Ireland (actor)-Victor Buono,Northeast of Seoul,1970s action thriller films-1972 films-American action thriller films-American films-Films directed by David Lowell Rich-Films set in South Korea-Films shot in South Korea-Golan-Globus films-Treasure hunt films,na,David Lowell Rich,na,David Lowell Rich,English
49,Police (1958 film),65932260,"Police is a 1958 Indian Hindi-language action-thriller film directed by Kalidas, produced by Deepa Khosla and Pradeep Kumar, and starring Madhubala, Pradeep Kumar and Nadira. The music of the film was composed by Hemant Kumar.",Pradeep Kumar-Madhubala,Police,1950s Hindi-language films-1958 films-Hindi-language films-Indian films,na,na,na,na,Hindi
50,A Good Day to Die Hard,34228306,"A Good Day to Die Hard is a 2013 American action-thriller film and the fifth installment in the Die Hard film series. The film was directed by John Moore and written by Skip Woods, and stars Bruce Willis as John McClane. The main plot finds McClane travelling to Russia to get his estranged son, Jack, an undercover CIA agent, out of prison. He is soon caught in the crossfire of a global terrorist plot. Alongside Willis, the film also stars Jai Courtney, Cole Hauser, Yulia Snigir and Sebastian Koch.",-Amaury Nolasco-Bruce Willis-Cole Hauser-Jai Courtney-Rasha Bukvić-Sebastian Koch-Sergei Kolesnikov-Yulia Snigir,A Good Day to Die Hard,"2013 action thriller films-2013 films-20th Century Fox films-American action thriller films-American films-American sequel films-Die Hard-English-language films-Films about families-Films about nuclear war and weapons-Films about terrorism in Europe-Films about the Central Intelligence Agency-Films directed by John Moore-Films produced by Wyck Godfrey-Films scored by Marco Beltrami-Films set in Moscow-Films set in New York City-Films set in Ukraine-Films set in Washington, D.C.-Films shot in Belgrade-Films shot in Budapest-Films with screenplays by Skip Woods-IMAX films-Russian-language films-TSG Entertainment films",Jonathan Sela,John Moore (director),3.047E8,John Moore (director),English
51,Sanctum (film),28236076,"Sanctum is a 2011 3D action-thriller film directed by Alister Grierson and written by John Garvin and Andrew Wight. It stars Richard Roxburgh, Rhys Wakefield, Alice Parkinson, Dan Wyllie, and Ioan Gruffudd. Wight also produced the film, with James Cameron as executive producer.",-Alice Parkinson-Dan Wyllie-Ioan Gruffudd-Rhys Wakefield-Richard Roxburgh,Sanctum,2010s action adventure films-2010s disaster films-2011 films-American action adventure films-American action thriller films-American disaster films-American films-Australian action adventure films-Australian action thriller films-Australian disaster films-Australian films-Caving-English-language films-FilmNation Entertainment films-Films about death-Films scored by David Hirschfelder-Films set in Papua New Guinea-Films shot at Village Roadshow Studios-Films shot in Australia-IMAX films-Relativity Media films-Survival thriller films-Universal Pictures films,na,Alister Grierson,1.086E8,Alister Grierson,English
52,Unknown (2011 film),26717073,"Unknown is a 2011 action-thriller film directed by Jaume Collet-Serra and starring Liam Neeson, Diane Kruger, January Jones, Aidan Quinn, Bruno Ganz, and Frank Langella. The film, produced by Joel Silver, Leonard Goldberg and Andrew Rona, is based on the 2003 French novel by Didier Van Cauwelaert published in English as Out of My Head which was adapted as the film's screenplay by Oliver Butcher and Stephen Cornwell. The narrative centers around a professor who wakes up from a four-day long coma and sets out to prove his identity after no one recognizes him, including his own wife, and another man claims to be him.",-Aidan Quinn-Diane Kruger-Frank Langella-January Jones-Liam Neeson,Unknown,2010s mystery thriller films-2011 action thriller films-2011 films-2011 psychological thriller films-American action thriller films-American chase films-American films-American mystery thriller films-Babelsberg Studio films-British action thriller films-British chase films-British films-British mystery thriller films-Dark Castle Entertainment films-English-language French films-English-language German films-English-language films-Films about altered memories-Films about amnesia-Films about identity theft-Films about murder-Films based on French novels-Films directed by Jaume Collet-Serra-Films produced by Joel Silver-Films scored by John Ottman-Films set in Berlin-Films shot in Berlin-French films-French mystery thriller films-German-language films-German films-German mystery thriller films-Thanksgiving in films-Warner Bros. films,na,Jaume Collet-Serra,1.357E8,Jaume Collet-Serra,English
53,Taken 2,35874076,"Taken 2 is a 2012 English-language French action-thriller film directed by Olivier Megaton and starring Liam Neeson, Maggie Grace, Famke Janssen, Rade Šerbedžija, Leland Orser, Jon Gries, D.B. Sweeney and Luke Grimes. It follows Bryan Mills taking his family to Istanbul, only to be kidnapped, along with his ex-wife, by the father of one of the men he killed while saving his daughter two years prior.",Famke Janssen-Liam Neeson-Maggie Grace-Rade Šerbedžija,Taken 2: Original Motion Picture Soundtrack,2010s chase films-2012 action thriller films-EuropaCorp films-Films directed by Olivier Megaton-Films scored by Nathaniel Méchaly-Films set in Albania-Films set in Istanbul-Films set in Paris-Films shot in Istanbul-Films shot in Los Angeles-Films shot in Turkey-Films with screenplays by Luc Besson-Films with screenplays by Robert Mark Kamen-French action thriller films-French films-French sequel films-French vigilante films-Taken (franchise),na,Olivier Megaton,na,Olivier Megaton,English
54,Maaligai,65314552,"Maaligai is an upcoming Indian Tamil-language action-thriller film Produced by Kamal Bohra and Rajesh Kumar. Story, Screenplay and Directed by Dil Sathya, Starring Andrea Jeremiah, Karthik Jayaram, Ashutosh Rana, K.S. Ravikumar and others.",Ali (actor)-Andrea Jeremiah-K.S.Ravikumar-Karthik Jayaram-Manobala,Maaligai,Films postponed due to the COVID-19 pandemic-Indian action drama films-Indian action thriller films-Indian fantasy adventure films-Indian fantasy drama films-Indian films-Masala films-Tamil-language films-Upcoming Indian films-Upcoming Tamil-language films-Upcoming films,na,na,na,na,Tamil
55,A Good Day to Die Hard,34228306,"A Good Day to Die Hard is a 2013 American action-thriller film and the fifth installment in the Die Hard film series. The film was directed by John Moore and written by Skip Woods, and stars Bruce Willis as John McClane. The main plot finds McClane travelling to Russia to get his estranged son, Jack, an undercover CIA agent, out of prison. He is soon caught in the crossfire of a global terrorist plot. Alongside Willis, the film also stars Jai Courtney, Cole Hauser, Yulia Snigir and Sebastian Koch.",-Amaury Nolasco-Bruce Willis-Cole Hauser-Jai Courtney-Rasha Bukvić-Sebastian Koch-Sergei Kolesnikov-Yulia Snigir,A Good Day to Die Hard: Original Motion Picture Soundtrack,"2013 action thriller films-2013 films-20th Century Fox films-American action thriller films-American films-American sequel films-Die Hard-English-language films-Films about families-Films about nuclear war and weapons-Films about terrorism in Europe-Films about the Central Intelligence Agency-Films directed by John Moore-Films produced by Wyck Godfrey-Films scored by Marco Beltrami-Films set in Moscow-Films set in New York City-Films set in Ukraine-Films set in Washington, D.C.-Films shot in Belgrade-Films shot in Budapest-Films with screenplays by Skip Woods-IMAX films-Russian-language films-TSG Entertainment films",Jonathan Sela,John Moore (director),3.047E8,John Moore (director),
56,The Bourne Supremacy (film),870946,"The Bourne Supremacy is a 2004 American action-thriller film featuring Robert Ludlum's Jason Bourne character. Although it takes the name of the second Bourne novel (1986), its plot is entirely different. The film was directed by Paul Greengrass from a screenplay by Tony Gilroy. It is the second installment in the Jason Bourne film series. It is preceded by The Bourne Identity (2002) and followed by The Bourne Ultimatum (2007), The Bourne Legacy (2012), and Jason Bourne (2016).",-Brian Cox-Franka Potente-Gabriel Mann-Joan Allen-Julia Stiles-Karl Urban-Matt Damon,The Bourne Supremacy,2000s spy thriller films-2004 action thriller films-2004 films-American action thriller films-American films-American films about revenge-American sequel films-American spy thriller films-Babelsberg Studio films-Bourne (film series)-English-language German films-English-language films-Films about United States Army Special Forces-Films about the Federal Security Service-Films directed by Paul Greengrass-Films produced by Frank Marshall-Films scored by John Powell-Films set in 2004-Films set in Berlin-Films set in Germany-Films set in India-Films set in Italy-Films set in Moscow-Films set in Munich-Films set in Naples-Films set in New York City-Films set in Russia-Films set in the Netherlands-Films shot in Goa-Films shot in Italy-Films shot in Moscow-Films shot in Russia-Films with screenplays by Tony Gilroy-Foreign films shot in India-German action thriller films-German films-German sequel films-The Kennedy/Marshall Company films-Universal Pictures films,Oliver Wood (cinematographer),Paul Greengrass,2.906E8,Paul Greengrass,English
57,Extraction (2020 film),58339992,"Extraction is a 2020 American action-thriller film starring Chris Hemsworth and released on Netflix. It is directed by Sam Hargrave (in his feature directorial debut) and written by Joe Russo, based on the graphic novel Ciudad by Ande Parks, Joe Russo, Anthony Russo, Fernando León González, and Eric Skillman. The film's cast also features Rudhraksh Jaiswal, Randeep Hooda, Golshifteh Farahani, Pankaj Tripathi and David Harbour, and follows a black ops mercenary who must rescue an Indian drug lord's kidnapped son in Dhaka, Bangladesh.",-Chris Hemsworth-David Harbour-Golshifteh Farahani-Pankaj Tripathi-Randeep Hooda-Rudhraksh Jaiswal,Extraction,2020 action thriller films-2020 films-2020s chase films-American action thriller films-American chase films-American films-English-language Netflix original films-English-language films-Fictional mercenaries-Films based on American comics-Films directed by Sam Hargrave-Films scored by Henry Jackman-Films set in Bangladesh-Films set in Dhaka-Films set in Western Australia-Films shot in Ahmedabad-Films shot in Bangladesh-Films shot in Dhaka-Films shot in Gujarat-Films shot in India-Films shot in Maharashtra-Films shot in Mumbai-Foreign films shot in Thailand-Live-action films based on comics-Oni Press adaptations,Newton Thomas Sigel,Sam Hargrave,na,Sam Hargrave,English
58,Force (film series),52409217,"Force is a series of Indian action-thriller films, produced by Vipul Amrutlal Shah. The first part directed by Nishikant Kamath released in 2011 and the second part directed by Abhinay Deo released in 2016. A third part of the series is in pre-production.",Genelia D'Souza-Sonakshi Sinha-John Abraham (actor)-Raj Babbar-Tahir Raj Bhasin-Vidyut Jamwal,Force series,Action film series-Fox Star Studios films-Hindi-language films-Indian film series-Viacom18 Studios films,Ayananka Bose,Abhinay Deo,na,Abhinay Deo,Hindi
59,Absolute Deception,38461562,"Absolute Deception (also known as Deception) is a 2013 Australian/Canadian international co-production action-thriller film directed by Brian Trenchard-Smith and starring Cuba Gooding Jr. and Emmanuelle Vaugier. The film was released on direct-to-DVD in the United States on June 11, 2013.",Cuba Gooding Jr.-Emmanuelle Vaugier,Absolute Deception,2013 action thriller films-Australian action adventure films-Australian action thriller films-Films set in Queensland-Sony Pictures direct-to-video films-Voltage Pictures films,na,Brian Trenchard-Smith,na,Brian Trenchard-Smith,English
60,The Bourne Legacy (film),29270563,"The Bourne Legacy is a 2012 American action-thriller film directed by Tony Gilroy, and is the fourth installment in the series of films adapted from the Jason Bourne novels originated by Robert Ludlum and continued by Eric Van Lustbader, being preceded by The Bourne Identity (2002), The Bourne Supremacy (2004), and The Bourne Ultimatum (2007). Although this film has the same title as Van Lustbader's first Bourne novel, The Bourne Legacy (2004), the actual screenplay bears little resemblance to the novel. Unlike the novel, which features Jason Bourne as the principal character, the film centers on black ops agent Aaron Cross (played by Jeremy Renner), an original character. In addition to Renner, the film stars Rachel Weisz and Edward Norton.",-Albert Finney-Edward Norton-Jeremy Renner-Joan Allen-Oscar Isaac-Rachel Weisz-Scott Glenn-Stacy Keach,The Bourne Legacy,"2010s spy films-2012 action thriller films-2012 films-American action thriller films-American films-American sequel films-American spy films-Bourne (film series)-Drone films-English-language films-Films about the Central Intelligence Agency-Films directed by Tony Gilroy-Films produced by Frank Marshall-Films scored by James Newton Howard-Films set in 2005-Films set in Alaska-Films set in Bangkok-Films set in Chicago-Films set in Karachi-Films set in Metro Manila-Films set in Montgomery County, Maryland-Films set in New York City-Films set in Palawan-Films set in Seoul-Films set in Washington, D.C.-Films shot in Alberta-Films shot in Metro Manila-Films shot in New York City-Films shot in Palawan-Films shot in Seoul-Films with screenplays by Dan Gilroy-Films with screenplays by Tony Gilroy-Government in fiction-Relativity Media films-The Kennedy/Marshall Company films-Universal Pictures films",Robert Elswit,Tony Gilroy,2.761E8,Tony Gilroy,English
61,A Good Day to Die Hard,34228306,"A Good Day to Die Hard is a 2013 American action-thriller film and the fifth installment in the Die Hard film series. The film was directed by John Moore and written by Skip Woods, and stars Bruce Willis as John McClane. The main plot finds McClane travelling to Russia to get his estranged son, Jack, an undercover CIA agent, out of prison. He is soon caught in the crossfire of a global terrorist plot. Alongside Willis, the film also stars Jai Courtney, Cole Hauser, Yulia Snigir and Sebastian Koch.",-Amaury Nolasco-Bruce Willis-Cole Hauser-Jai Courtney-Rasha Bukvić-Sebastian Koch-Sergei Kolesnikov-Yulia Snigir,A Good Day to Die Hard: Original Motion Picture Soundtrack,"2013 action thriller films-2013 films-20th Century Fox films-American action thriller films-American films-American sequel films-Die Hard-English-language films-Films about families-Films about nuclear war and weapons-Films about terrorism in Europe-Films about the Central Intelligence Agency-Films directed by John Moore-Films produced by Wyck Godfrey-Films scored by Marco Beltrami-Films set in Moscow-Films set in New York City-Films set in Ukraine-Films set in Washington, D.C.-Films shot in Belgrade-Films shot in Budapest-Films with screenplays by Skip Woods-IMAX films-Russian-language films-TSG Entertainment films",Jonathan Sela,John Moore (director),3.047E8,John Moore (director),Russian
62,The Accountant (2016 film),44388848,"The Accountant is a 2016 American action-thriller film directed by Gavin O'Connor, written by Bill Dubuque and starring Ben Affleck, Anna Kendrick, J. K. Simmons, Jon Bernthal, Cynthia Addai-Robinson, Jeffrey Tambor, and John Lithgow. The storyline follows Christian Wolff, an autistic certified public accountant who makes his living uncooking the books of criminal and terrorist organizations around the world that are experiencing internal embezzlement.",-Anna Kendrick-Ben Affleck-J. K. Simmons-Jeffrey Tambor-John Lithgow-Jon Bernthal,The Accountant,"2016 action thriller films-2016 drama films-2016 films-2016 martial arts films-American action thriller films-American films-American martial arts films-English-language films-Films about assassinations-Films about autism-Films about brothers-Films about dysfunctional families-Films about security and surveillance-Films about the United States Army's psychological operations units-Films directed by Gavin O'Connor-Films scored by Mark Isham-Films set in 1989-Films set in 2016-Films set in Illinois-Films set in Washington, D.C.-Films shot in Atlanta-Warner Bros. films",Seamus McGarvey,Gavin O'Connor (filmmaker),1.552E8,Gavin O'Connor (filmmaker),English
63,Taken 3,38964482,"Taken 3 (sometimes stylized as Tak3n) is a 2014 English-language French action-thriller film directed by Olivier Megaton and written by Luc Besson and Robert Mark Kamen. It is the third and final installment in the Taken trilogy. A co-production between France, Spain and the United States, the film stars Liam Neeson, Forest Whitaker, Maggie Grace and Famke Janssen.",Dougray Scott-Famke Janssen-Forest Whitaker-Leland Orser-Liam Neeson-Maggie Grace-Sam Spruell,Taken 3: Original Motion Picture Soundtrack,American action thriller films-American films-American films about revenge-American sequel films-English-language French films-English-language films-EuropaCorp films-Films directed by Olivier Megaton-Films scored by Nathaniel Méchaly-Films set in Afghanistan-Films set in Los Angeles-Films shot in Georgia (U.S. state)-Films shot in Los Angeles-Films with screenplays by Luc Besson-Films with screenplays by Robert Mark Kamen-French action thriller films-French films-French sequel films-French vigilante films-IMAX films-Spanish action thriller films-Spanish films-TSG Entertainment films-Taken (franchise),na,Olivier Megaton,3.264E8,Olivier Megaton,Russian
64,Taken 3,38964482,"Taken 3 (sometimes stylized as Tak3n) is a 2014 English-language French action-thriller film directed by Olivier Megaton and written by Luc Besson and Robert Mark Kamen. It is the third and final installment in the Taken trilogy. A co-production between France, Spain and the United States, the film stars Liam Neeson, Forest Whitaker, Maggie Grace and Famke Janssen.",Dougray Scott-Famke Janssen-Forest Whitaker-Leland Orser-Liam Neeson-Maggie Grace-Sam Spruell,Taken 3,American sequel films-English-language French films-English-language films-EuropaCorp films-Films directed by Olivier Megaton-Films scored by Nathaniel Méchaly-Films set in Afghanistan-Films set in Los Angeles-Films shot in Georgia (U.S. state)-Films shot in Los Angeles-Films with screenplays by Luc Besson-Films with screenplays by Robert Mark Kamen-French action thriller films-French films-French sequel films-French vigilante films-IMAX films-Spanish action thriller films-Spanish films-TSG Entertainment films-Taken (franchise),na,Olivier Megaton,3.264E8,Olivier Megaton,English
65,Cover Story (2000 film),26394441,"Cover Story is a 2000 Indian Malayalam-language action-thriller film directed by G. S. Vijayan, written by B. Unnikrishnan and produced by Menaka under the production banner Revathy Kalamandhir. Starring Suresh Gopi and Tabu. The film was edited by A. Sreekar Prasad and had soundtrack composed by Sharreth.",Biju Menon-Nedumudi Venu-Tabu-Suresh Gopi,Cover Story,2000 action thriller films-2000 films-2000s Malayalam-language films-Films directed by G. S. Vijayan-Indian action thriller films-Indian films,na,G. S. Vijayan,na,G. S. Vijayan,http://dbpedia.org/resource/Malayalam
66,Taken 2,35874076,"Taken 2 is a 2012 English-language French action-thriller film directed by Olivier Megaton and starring Liam Neeson, Maggie Grace, Famke Janssen, Rade Šerbedžija, Leland Orser, Jon Gries, D.B. Sweeney and Luke Grimes. It follows Bryan Mills taking his family to Istanbul, only to be kidnapped, along with his ex-wife, by the father of one of the men he killed while saving his daughter two years prior.",Famke Janssen-Liam Neeson-Maggie Grace-Rade Šerbedžija,Taken 2: Original Motion Picture Soundtrack,2012 films-20th Century Fox films-Albanian Mafia-American action thriller films-American films-American sequel films-English-language French films-English-language films-Films about families-Films about kidnapping-Films produced by Luc Besson-Films set in Los Angeles-Films set in Paris-Films shot in Paris-French films about revenge,na,Olivier Megaton,na,Olivier Megaton,English
67,Blood Brother (2018 film),49218770,"Blood Brother is an American action-thriller film directed by John Pogue and written by Michael Finch, Karl Gajdusek, and Charles Murray. The film stars Trey Songz.",China Anne McClain-Fetty Wap-Hassan Johnson-Jack Kesy-Ron Killings-Trey Songz,Blood Brother,2018 action thriller films-American action thriller films-American films-Films directed by John Pogue-Films shot in New Orleans-Hood films-WWE Studios films,na,John Pogue,na,John Pogue,English
68,Primal (2019 film),62093882,"Primal is a 2019 action-thriller film directed by Nick Powell and starring Nicolas Cage, Famke Janssen, Kevin Durand, LaMonica Garrett, and Michael Imperioli. The film was shot in Puerto Rico and released in the United States on November 8, 2019.",-Famke Janssen-Kevin Durand-LaMonica Garrett-Michael Imperioli-Nicolas Cage,Primal,2019 action thriller films-2019 films-American action thriller films-American films,na,na,na,na,English
